{
  "schemaVersion": 1,
  "name": "workspace-summary",
  "version": "0.1.0-candidate.1",
  "source": {
    "repository": "AgoraIO-Extensions/agent-infra",
    "path": "deploy/runtime/skills/workspace-summary"
  },
  "runtime": {
    "kind": "codex",
    "version": "0.153.0",
    "upstreamCommit": "41e22fee981a63b3698df7ed36bad393cda24715"
  },
  "extraRoot": "/opt/codex/agent-infra-skills",
  "packageRoot": "/opt/codex/agent-infra-skills/workspace-summary",
  "entryPath": "/opt/codex/agent-infra-skills/workspace-summary/SKILL.md",
  "files": [
    {
      "path": "SKILL.md",
      "sizeBytes": 1373,
      "sha256": "af9ba615c92dcf53c6d5742b3d6043e4452b4499e0cdb561f4748033881472b2"
    }
  ],
  "packageDigest": {
    "algorithm": "sha256-json-file-inventory-v1",
    "sha256": "1ab20d81137fec09e015d9eadf953b37f4514c3b2cc02ead0dd879e7c2a86889"
  }
}
